{"adapter_version":"provider-plan-v1","database_manifest_sha256":"7a3ac208fe1f59f8ce0a14eaf25229ab7ba505321e5d537457c3206442e0473c","disabled_providers":["esm_atlas"],"enabled_providers":["afdb_exact","foldseek_prostt5_pdb","pdb_sequence"],"entries":[{"configured_max_hits":1,"database_resources":[{"database_id":"db_fixture_coordinate_cache","resource_manifest_sha256":"1111111111111111111111111111111111111111111111111111111111111111","resource_name":"coordinate_cache"}],"disabled_reason":null,"effective_max_hits":1,"enabled":true,"entry_id":"providerentry_89d9fb3161b666874ed126c90d67c7449fb3f8db6c0baaa7fabcfe8aa28376e0","execution_class":"needs_internet","max_sequence_length":null,"provider":"afdb_exact","provider_adapter_version":"afdb-exact-v3","requests_per_minute":null,"result_provider":"afdb_exact","schema_version":"1.0","support_status":"available"},{"configured_max_hits":2,"database_resources":[],"disabled_reason":"disabled_by_pipeline_config","effective_max_hits":0,"enabled":false,"entry_id":"providerentry_c4dede2ab1822cbab26f246c914a79641862c29d284d051004de58f46cfa2bd5","execution_class":"disabled","max_sequence_length":1500,"provider":"esm_atlas","provider_adapter_version":null,"requests_per_minute":10,"result_provider":"esm_atlas","schema_version":"1.0","support_status":"unsupported"},{"configured_max_hits":3,"database_resources":[{"database_id":"db_fixture_coordinate_cache","resource_manifest_sha256":"1111111111111111111111111111111111111111111111111111111111111111","resource_name":"coordinate_cache"},{"database_id":"db_fixture_pdb_foldseek","resource_manifest_sha256":"2222222222222222222222222222222222222222222222222222222222222222","resource_name":"pdb_foldseek"},{"database_id":"db_fixture_pdb_sequences","resource_manifest_sha256":"3333333333333333333333333333333333333333333333333333333333333333","resource_name":"pdb_sequences"},{"database_id":"db_fixture_prostt5","resource_manifest_sha256":"4444444444444444444444444444444444444444444444444444444444444444","resource_name":"prostt5"}],"disabled_reason":null,"effective_max_hits":3,"enabled":true,"entry_id":"providerentry_d0b4586fd4bd6c7b48f4611b3d4ab1a258ab64ede0e914981161964eb3cf9c51","execution_class":"local_compute","max_sequence_length":null,"provider":"foldseek_prostt5_pdb","provider_adapter_version":"prostt5-foldseek-pdb-v6","requests_per_minute":null,"result_provider":"foldseek_prostt5_pdb","schema_version":"1.0","support_status":"available"},{"configured_max_hits":3,"database_resources":[{"database_id":"db_fixture_coordinate_cache","resource_manifest_sha256":"1111111111111111111111111111111111111111111111111111111111111111","resource_name":"coordinate_cache"},{"database_id":"db_fixture_pdb_sequences","resource_manifest_sha256":"3333333333333333333333333333333333333333333333333333333333333333","resource_name":"pdb_sequences"}],"disabled_reason":null,"effective_max_hits":3,"enabled":true,"entry_id":"providerentry_461a11bfd49a30201d154b34fb15d4b59b6a0449fb2908c4d4f2b7f01a3600a1","execution_class":"local_compute","max_sequence_length":null,"provider":"pdb_sequence","provider_adapter_version":"pdb-sequence-mmseqs-v5","requests_per_minute":null,"result_provider":"pdb_sequence_mmseqs","schema_version":"1.0","support_status":"available"}],"entry_sha256":{"afdb_exact":"39ea90acc3866d2dbe1a9ebb1bf9da27621fe8d25ee991106cd132f0f04e462d","esm_atlas":"e7c2407d68597aa59fd9a82de7f10ed620293f6cbf8fef6818ee9d7ac007125b","foldseek_prostt5_pdb":"59454e244f018e322456abc7e963f4e36950f538a2974e2749fcf6a22b3cf86c","pdb_sequence":"8d9f8eec0a76a17b474063ab029082d98b00561ea90c48cd36bca97b743ca27c"},"pipeline_config_sha256":"59e219cf3ace3a8de5f0439eaee6feaa0213822f0e8e636cac90eb942573d9af","plan_id":"providerplan_97b81f3c10847acaa3f7704545df9f665adf8469faa783ebbe8be00bf2225e64","schema_version":"1.0"}
